{
  "skillId": "research-company",
  "procedureId": "procedures/0000aaaa-research-a-company-fixture",
  "examCase": "exam-northwind",
  "student": {
    "id": "agent-student-0002",
    "name": "Scout (fresh student)",
    "harness": "qm"
  },
  "runId": "run-fixture-0002",
  "artifact": {
    "type": "company.json",
    "path": "demo/fixtures/company.json"
  },
  "verification": {
    "passed": true,
    "checks": [
      {
        "name": "file_exists",
        "passed": true,
        "message": "file exists"
      },
      {
        "name": "valid_json_object",
        "passed": true,
        "message": "valid JSON object"
      },
      {
        "name": "company_name_present",
        "passed": true,
        "message": "company_name present"
      },
      {
        "name": "website_valid_url",
        "passed": true,
        "message": "website present (http(s) URL)"
      },
      {
        "name": "product_summary_present",
        "passed": true,
        "message": "product_summary present"
      },
      {
        "name": "source_urls_min_two",
        "passed": true,
        "message": "at least two valid source URLs (3 distinct valid)"
      }
    ]
  },
  "passed": true
}
